{
  "edges": [
    {
      "from": "subject",
      "to": "member",
      "type": "source"
    },
    {
      "from": "object",
      "to": "member",
      "type": "source"
    },
    {
      "from": "covenant",
      "to": "mandate",
      "type": "source"
    },
    {
      "from": "record",
      "to": "mandate",
      "type": "source"
    },
    {
      "from": "record",
      "to": "standing",
      "type": "source"
    },
    {
      "from": "subject",
      "to": "standing",
      "type": "source"
    },
    {
      "from": "object",
      "to": "standing",
      "type": "source"
    },
    {
      "from": "covenant",
      "to": "standard",
      "type": "source"
    },
    {
      "from": "system",
      "to": "standard",
      "type": "source"
    },
    {
      "from": "actor",
      "to": "governance",
      "type": "source"
    },
    {
      "from": "agent",
      "to": "governance",
      "type": "source"
    },
    {
      "from": "system",
      "to": "governance",
      "type": "source"
    },
    {
      "from": "record",
      "to": "governance",
      "type": "source"
    },
    {
      "from": "covenant",
      "to": "governance",
      "type": "source"
    },
    {
      "from": "event",
      "to": "exchange",
      "type": "source"
    },
    {
      "from": "record",
      "to": "exchange",
      "type": "source"
    },
    {
      "from": "standing",
      "to": "entitlement",
      "type": "source"
    },
    {
      "from": "record",
      "to": "entitlement",
      "type": "source"
    },
    {
      "from": "covenant",
      "to": "obligation",
      "type": "source"
    },
    {
      "from": "mandate",
      "to": "obligation",
      "type": "source"
    }
  ],
  "graph": {
    "edges": [
      {
        "from": "layer:lower",
        "to": "primitive:object",
        "type": "contains"
      },
      {
        "from": "layer:lower",
        "to": "primitive:subject",
        "type": "contains"
      },
      {
        "from": "layer:lower",
        "to": "primitive:agent",
        "type": "contains"
      },
      {
        "from": "layer:lower",
        "to": "primitive:actor",
        "type": "contains"
      },
      {
        "from": "layer:lower",
        "to": "primitive:system",
        "type": "contains"
      },
      {
        "from": "layer:lower",
        "to": "primitive:event",
        "type": "contains"
      },
      {
        "from": "layer:lower",
        "to": "primitive:record",
        "type": "contains"
      },
      {
        "from": "layer:lower",
        "to": "primitive:covenant",
        "type": "contains"
      },
      {
        "from": "layer:institutional",
        "to": "primitive:member",
        "type": "contains"
      },
      {
        "from": "layer:institutional",
        "to": "primitive:mandate",
        "type": "contains"
      },
      {
        "from": "layer:institutional",
        "to": "primitive:standing",
        "type": "contains"
      },
      {
        "from": "layer:institutional",
        "to": "primitive:standard",
        "type": "contains"
      },
      {
        "from": "layer:institutional",
        "to": "primitive:governance",
        "type": "contains"
      },
      {
        "from": "layer:value",
        "to": "primitive:exchange",
        "type": "contains"
      },
      {
        "from": "layer:value",
        "to": "primitive:entitlement",
        "type": "contains"
      },
      {
        "from": "layer:value",
        "to": "primitive:obligation",
        "type": "contains"
      },
      {
        "from": "primitive:subject",
        "to": "primitive:member",
        "type": "source"
      },
      {
        "from": "primitive:object",
        "to": "primitive:member",
        "type": "source"
      },
      {
        "from": "primitive:covenant",
        "to": "primitive:mandate",
        "type": "source"
      },
      {
        "from": "primitive:record",
        "to": "primitive:mandate",
        "type": "source"
      },
      {
        "from": "primitive:record",
        "to": "primitive:standing",
        "type": "source"
      },
      {
        "from": "primitive:subject",
        "to": "primitive:standing",
        "type": "source"
      },
      {
        "from": "primitive:object",
        "to": "primitive:standing",
        "type": "source"
      },
      {
        "from": "primitive:covenant",
        "to": "primitive:standard",
        "type": "source"
      },
      {
        "from": "primitive:system",
        "to": "primitive:standard",
        "type": "source"
      },
      {
        "from": "primitive:actor",
        "to": "primitive:governance",
        "type": "source"
      },
      {
        "from": "primitive:agent",
        "to": "primitive:governance",
        "type": "source"
      },
      {
        "from": "primitive:system",
        "to": "primitive:governance",
        "type": "source"
      },
      {
        "from": "primitive:record",
        "to": "primitive:governance",
        "type": "source"
      },
      {
        "from": "primitive:covenant",
        "to": "primitive:governance",
        "type": "source"
      },
      {
        "from": "primitive:event",
        "to": "primitive:exchange",
        "type": "source"
      },
      {
        "from": "primitive:record",
        "to": "primitive:exchange",
        "type": "source"
      },
      {
        "from": "primitive:standing",
        "to": "primitive:entitlement",
        "type": "source"
      },
      {
        "from": "primitive:record",
        "to": "primitive:entitlement",
        "type": "source"
      },
      {
        "from": "primitive:covenant",
        "to": "primitive:obligation",
        "type": "source"
      },
      {
        "from": "primitive:mandate",
        "to": "primitive:obligation",
        "type": "source"
      },
      {
        "from": "projection:organ_kernel",
        "to": "primitive:member",
        "type": "projects"
      },
      {
        "from": "projection:organ_kernel",
        "to": "primitive:mandate",
        "type": "projects"
      },
      {
        "from": "projection:organ_kernel",
        "to": "primitive:standing",
        "type": "projects"
      },
      {
        "from": "projection:organ_kernel",
        "to": "primitive:standard",
        "type": "projects"
      },
      {
        "from": "projection:organ_kernel",
        "to": "primitive:governance",
        "type": "projects"
      },
      {
        "from": "projection:record_proof",
        "to": "primitive:event",
        "type": "projects"
      },
      {
        "from": "projection:record_proof",
        "to": "primitive:record",
        "type": "projects"
      },
      {
        "from": "projection:record_proof",
        "to": "primitive:standing",
        "type": "projects"
      },
      {
        "from": "projection:value_proof",
        "to": "primitive:exchange",
        "type": "projects"
      },
      {
        "from": "projection:value_proof",
        "to": "primitive:entitlement",
        "type": "projects"
      },
      {
        "from": "projection:value_proof",
        "to": "primitive:obligation",
        "type": "projects"
      },
      {
        "from": "organ:legal",
        "to": "projection:organ_kernel",
        "type": "implements"
      },
      {
        "from": "organ:financial",
        "to": "projection:organ_kernel",
        "type": "implements"
      },
      {
        "from": "organ:education",
        "to": "projection:organ_kernel",
        "type": "implements"
      },
      {
        "from": "organ:media",
        "to": "projection:organ_kernel",
        "type": "implements"
      },
      {
        "from": "organ:governance",
        "to": "projection:organ_kernel",
        "type": "implements"
      },
      {
        "from": "organ:consulting",
        "to": "projection:organ_kernel",
        "type": "implements"
      },
      {
        "from": "organ:artist",
        "to": "projection:organ_kernel",
        "type": "implements"
      },
      {
        "from": "organ:social",
        "to": "projection:organ_kernel",
        "type": "implements"
      },
      {
        "from": "organ:health",
        "to": "projection:organ_kernel",
        "type": "implements"
      },
      {
        "from": "organ:hr",
        "to": "projection:organ_kernel",
        "type": "implements"
      },
      {
        "from": "organ:contributions",
        "to": "projection:organ_kernel",
        "type": "implements"
      }
    ],
    "nodes": [
      {
        "id": "layer:institutional",
        "kind": "layer",
        "label": "institutional",
        "ref": "institutional"
      },
      {
        "id": "layer:lower",
        "kind": "layer",
        "label": "lower",
        "ref": "lower"
      },
      {
        "id": "layer:value",
        "kind": "layer",
        "label": "value",
        "ref": "value"
      },
      {
        "id": "primitive:object",
        "kind": "primitive",
        "label": "Object",
        "layer": "lower",
        "ref": "object"
      },
      {
        "id": "primitive:subject",
        "kind": "primitive",
        "label": "Subject",
        "layer": "lower",
        "ref": "subject"
      },
      {
        "id": "primitive:agent",
        "kind": "primitive",
        "label": "Agent",
        "layer": "lower",
        "ref": "agent"
      },
      {
        "id": "primitive:actor",
        "kind": "primitive",
        "label": "Actor",
        "layer": "lower",
        "ref": "actor"
      },
      {
        "id": "primitive:system",
        "kind": "primitive",
        "label": "System",
        "layer": "lower",
        "ref": "system"
      },
      {
        "id": "primitive:event",
        "kind": "primitive",
        "label": "Event",
        "layer": "lower",
        "ref": "event"
      },
      {
        "id": "primitive:record",
        "kind": "primitive",
        "label": "Record",
        "layer": "lower",